{
  "$schema": "https://json-schema.org/draft/2020-12/schema",
  "$id": "klode-kit/fixes.json",
  "title": "Audit decision",
  "description": "audit/<batch>/a<N>/fixes.jsonl (append-only): one decision for one field (02 r3.1 segment 2, r2.3, r3.4). route needs the route; manual needs a non-empty value and evidence.region; none is a dropped/undecided field.",
  "type": "object",
  "additionalProperties": false,
  "required": [
    "decision_id",
    "commit_id",
    "field_id",
    "rev_base",
    "rev_new",
    "by",
    "choice",
    "evidence",
    "at"
  ],
  "properties": {
    "decision_id": {
      "type": "string",
      "pattern": "^[0-9a-f]{12}/\\S+$"
    },
    "commit_id": {
      "type": "string",
      "pattern": "^[0-9a-f]{12}/\\S+$"
    },
    "audit_rev": {
      "type": "string",
      "pattern": "^[0-9a-f]{12}/a[0-9]+$"
    },
    "reopen_id": {
      "type": "string",
      "pattern": "^[0-9a-f]{12}/a[0-9]+/o[0-9]{4}$",
      "description": "WI-08e: the kb-audit --reopen event (reopen.jsonl) this decision answers; absent on ordinary decisions."
    },
    "field_id": {
      "type": "string",
      "pattern": "^r-[0-9a-f]{12}/[^/\\s]+$"
    },
    "rev_base": {
      "type": "integer",
      "minimum": 0
    },
    "rev_new": {
      "type": "integer",
      "minimum": 1
    },
    "at": {
      "type": "string",
      "pattern": "^\\d{4}-\\d{2}-\\d{2}T\\d{2}:\\d{2}:\\d{2}(\\.\\d+)?(Z|[+-]\\d{2}:\\d{2})$"
    },
    "by": {
      "enum": [
        "auto",
        "human"
      ]
    },
    "choice": {
      "enum": [
        "route",
        "manual",
        "none"
      ]
    },
    "route": {
      "enum": [
        "vision",
        "mlx",
        "claude",
        "codex",
        "pdftext",
        "tesseract",
        null
      ]
    },
    "value": {
      "type": [
        "string",
        "null"
      ]
    },
    "evidence": {
      "type": "object",
      "additionalProperties": false,
      "required": [
        "seen"
      ],
      "properties": {
        "seen": {
          "type": "object",
          "propertyNames": {
            "enum": [
              "vision",
              "mlx",
              "claude",
              "codex",
              "pdftext",
              "tesseract"
            ]
          },
          "additionalProperties": {
            "type": [
              "string",
              "null"
            ]
          }
        },
        "region": {
          "type": "object",
          "additionalProperties": false,
          "required": [
            "der_sha256",
            "bbox_px"
          ],
          "properties": {
            "der_sha256": {
              "type": "string",
              "pattern": "^[0-9a-f]{64}$"
            },
            "bbox_px": {
              "type": "array",
              "items": {
                "type": "number",
                "minimum": 0
              },
              "minItems": 4,
              "maxItems": 4
            }
          }
        },
        "confirm_sha256": {
          "type": "string",
          "pattern": "^[0-9a-f]{64}$"
        },
        "reason": {
          "type": "string",
          "minLength": 1
        }
      }
    }
  },
  "allOf": [
    {
      "if": {
        "required": [
          "choice"
        ],
        "properties": {
          "choice": {
            "const": "route"
          }
        }
      },
      "then": {
        "required": [
          "route",
          "value"
        ],
        "properties": {
          "route": {
            "enum": [
              "vision",
              "mlx",
              "claude",
              "codex",
              "pdftext",
              "tesseract"
            ]
          },
          "value": {
            "type": "string"
          }
        }
      }
    },
    {
      "if": {
        "required": [
          "choice"
        ],
        "properties": {
          "choice": {
            "const": "manual"
          }
        }
      },
      "then": {
        "required": [
          "value"
        ],
        "properties": {
          "value": {
            "type": "string",
            "minLength": 1
          },
          "evidence": {
            "required": [
              "region"
            ]
          }
        }
      }
    }
  ]
}
