{
  "at": "2026-10-22T00:00:00Z",
  "audit_rev": "c9d0e1f2c9d0/a1",
  "by": "auto",
  "choice": "route",
  "commit_id": "c9d0e1f2c9d0/a1/c0001",
  "decision_id": "c9d0e1f2c9d0/a1/d0002",
  "evidence": {
    "seen": {
      "claude": "6.8",
      "codex": "6.8",
      "mlx": "6.8",
      "vision": "6.2"
    }
  },
  "field_id": "r-e5f6a7b8e5f6/labs[0].value",
  "rev_base": 0,
  "rev_new": 1,
  "route": "vision",
  "value": "6.2"
}
